{
  "schemaVersion": "1.0",
  "bundleId": "design-bundle-001",
  "requestId": "design-dashboard-001",
  "revisionId": "design-revision-001",
  "previousRevisionId": null,
  "sourceDigest": "sha256:53f50e60acdf44bc78fa0eac5c122b5a3c08214f2ca3974cdb33edb2e01165a9",
  "designSystemBaseRevision": {
    "provider": "git",
    "externalId": "control-plane-design-system",
    "uri": "https://example.com/acme/design-system",
    "revision": "main",
    "digest": "sha256:bbbbbbbbbbbbbbbbbbbbbbbbbbbbbbbbbbbbbbbbbbbbbbbbbbbbbbbbbbbbbbbb"
  },
  "artifacts": {
    "experience": {
      "path": "contracts/v1/examples/experience-contract.example.json",
      "digest": "sha256:568a18c1c5132f859bf41f54d1ce85e37c3cc9aba29bc297a01d555d65177bc1",
      "mediaType": "application/json",
      "schemaRef": "urn:forma:schema:v1:experience-contract"
    },
    "designSystemDelta": {
      "path": "contracts/v1/examples/design-system-delta.example.json",
      "digest": "sha256:e526e7803e355fa89022253d3832f581f40febccaa5980bf54fdde46210e7b22",
      "mediaType": "application/json",
      "schemaRef": "urn:forma:schema:v1:design-system-delta"
    },
    "designTokens": {
      "path": "contracts/v1/examples/dashboard.tokens.json",
      "digest": "sha256:bb50b5fdfce61daef50f456e16b1acdce0a003f969fd28f96c002ff1929bd1c7",
      "mediaType": "application/design-tokens+json",
      "schemaRef": "https://www.designtokens.org/TR/2025.10/format/"
    },
    "capabilityRequirements": {
      "path": "contracts/v1/examples/capability-requirements.example.json",
      "digest": "sha256:aff73c6d9710d6c0a258aaeaeb7cb42d0ddc499bf306b7111c218f2377349ed8",
      "mediaType": "application/json",
      "schemaRef": "urn:forma:schema:v1:capability-requirements"
    },
    "preview": {
      "path": "contracts/v1/examples/preview.html",
      "digest": "sha256:bb75faf61ee74d436037f7c189c7baf3a24f5b6eaf275819120ca47ad8c765e5",
      "mediaType": "text/html",
      "schemaRef": "none"
    }
  },
  "authorInvocationRefs": {
    "author-experience-dashboard-001": {
      "provider": "forma-mock",
      "toolOrModel": "deterministic-fixture",
      "profileRevision": "contract-v1.0.0-rc.2",
      "inputContextDigest": "sha256:bf713b943e178f677165dd2de7e7f38cfd7cef9376a641e8ca9823482312a4ba",
      "instructionDigest": "sha256:aaaaaaaaaaaaaaaaaaaaaaaaaaaaaaaaaaaaaaaaaaaaaaaaaaaaaaaaaaaaaaaa",
      "outputDigest": "sha256:568a18c1c5132f859bf41f54d1ce85e37c3cc9aba29bc297a01d555d65177bc1"
    },
    "author-design-system-dashboard-001": {
      "provider": "forma-mock",
      "toolOrModel": "deterministic-fixture",
      "profileRevision": "contract-v1.0.0-rc.2",
      "inputContextDigest": "sha256:bf713b943e178f677165dd2de7e7f38cfd7cef9376a641e8ca9823482312a4ba",
      "instructionDigest": "sha256:bbbbbbbbbbbbbbbbbbbbbbbbbbbbbbbbbbbbbbbbbbbbbbbbbbbbbbbbbbbbbbbb",
      "outputDigest": "sha256:e526e7803e355fa89022253d3832f581f40febccaa5980bf54fdde46210e7b22"
    },
    "derive-capabilities-dashboard-001": {
      "provider": "forma-mock",
      "toolOrModel": "deterministic-fixture",
      "profileRevision": "contract-v1.0.0-rc.2",
      "inputContextDigest": "sha256:bf713b943e178f677165dd2de7e7f38cfd7cef9376a641e8ca9823482312a4ba",
      "instructionDigest": "sha256:cccccccccccccccccccccccccccccccccccccccccccccccccccccccccccccccc",
      "outputDigest": "sha256:aff73c6d9710d6c0a258aaeaeb7cb42d0ddc499bf306b7111c218f2377349ed8"
    }
  },
  "bundleDigest": "sha256:9cab57feec6731810972ac213adc147ae9ef023d264b6f5567cfcebee7995fb7",
  "createdAt": "2026-07-25T03:30:00.000Z"
}
